Name,Description,Example,Type,Format,Required,Nullable,Enum,Pattern
id,El identificador 煤nico creado por Belvo utilizado para referenciar el saldo actual.,0b94bdf9-3719-43a9-81e7-be95d2318595,string,uuid,Yes,No,,
link,El identificador 煤nico del enlace al que pertenece este balance.,0b94bdf9-3719-43a9-81e7-be95d2318595,string,uuid,Yes,No,,
account_id,El `account.id` de Belvo al que pertenece este balance.,c4bfecf9-4eb6-4920-9f9f-e1f1e60ef321,string,uuid,Yes,No,,
account_internal_identification,La identificaci贸n interna de la instituci贸n para la cuenta.,92792126019929279212650822221989319252576,string,,Yes,No,,
collected_at,La marca de tiempo ISO-8601 cuando se recopil贸 el punto de datos.,2024-05-21T08:32:00Z,string,date-time,Yes,No,,
created_at,La marca de tiempo ISO-8601 de cuando se cre贸 el punto de datos en la base de datos de Belvo.,2024-05-21T08:32:00Z,string,date-time,Yes,No,,
last_updated_at,"La marca de tiempo ISO-8601 de cuando esta instituci贸n actualiz贸 por 煤ltima vez el saldo.

>  Advertencia
>
> El par谩metro `last_updated_at` depende de c贸mo la instituci贸n procesa (o almacena) los datos. En el caso de que la instituci贸n almacene datos de manera sincr贸nica (es decir, tan pronto como ocurre una transacci贸n, el saldo se actualiza), entonces `last_updated_at` reflejar谩 el saldo en tiempo casi real. En el caso de que la instituci贸n almacene datos de manera asincr贸nica (es decir, recupera datos en bloque y luego actualiza el saldo), la informaci贸n del saldo puede referirse a horas o d铆as atr谩s. Adem谩s, en el caso de que la instituci贸n no pueda proporcionar la hora espec铆fica (debido a un error interno), la instituci贸n puede proporcionar una hora general en la que actualizaron por 煤ltima vez la informaci贸n de la cuenta y el saldo.",2021-05-21T08:30:00Z,string,date-time,Yes,No,,
currency,El c贸digo de moneda de tres letras (ISO-4217).,USD,string,,Yes,No,,^[A-Z]{3}$
available,El saldo disponible de la cuenta.,1000.02,number,float,Yes,No,,"^\d{1,15}\.\d{2,4}$"
blocked,"La cantidad que est谩 actualmente bloqueada debido, por ejemplo, a transacciones pendientes.",1000.02,number,float,Yes,No,,"^\d{1,15}\.\d{2,4}$"
automatically_invested,La cantidad que se invierte autom谩ticamente (seg煤n lo acordado con la instituci贸n).,1000.02,number,float,Yes,No,,"^\d{1,15}\.\d{2,4}$"
